{
  "actions": [
    {
      "ack_us": 175001000,
      "action_id": "a.lease",
      "action_kind": "LEASE_ACQUIRE",
      "end_us": 175001000,
      "enqueue_us": 175000000,
      "lease_id": "lease.0",
      "parent_action_id": null,
      "request_ids": [],
      "start_us": 175000000,
      "state": "COMPLETE"
    },
    {
      "ack_us": 175500000,
      "action_id": "a.prefetch",
      "action_kind": "PREFETCH",
      "end_us": 175500000,
      "enqueue_us": 175000000,
      "lease_id": null,
      "parent_action_id": null,
      "request_ids": [],
      "start_us": 175001000,
      "state": "COMPLETE"
    },
    {
      "ack_us": 175900000,
      "action_id": "a.h2d",
      "action_kind": "H2D",
      "end_us": 175900000,
      "enqueue_us": 175500000,
      "lease_id": null,
      "parent_action_id": null,
      "request_ids": [],
      "start_us": 175500000,
      "state": "COMPLETE"
    },
    {
      "ack_us": 175920000,
      "action_id": "a.submit.0",
      "action_kind": "QUEUE_SUBMIT",
      "end_us": 175920000,
      "enqueue_us": 175920000,
      "lease_id": null,
      "parent_action_id": null,
      "request_ids": [
        "req.0"
      ],
      "start_us": 175920000,
      "state": "COMPLETE"
    },
    {
      "ack_us": 175930000,
      "action_id": "a.submit.1",
      "action_kind": "QUEUE_SUBMIT",
      "end_us": 175930000,
      "enqueue_us": 175930000,
      "lease_id": null,
      "parent_action_id": null,
      "request_ids": [
        "req.1"
      ],
      "start_us": 175930000,
      "state": "COMPLETE"
    },
    {
      "ack_us": 175940000,
      "action_id": "a.submit.2",
      "action_kind": "QUEUE_SUBMIT",
      "end_us": 175940000,
      "enqueue_us": 175940000,
      "lease_id": null,
      "parent_action_id": null,
      "request_ids": [
        "req.2"
      ],
      "start_us": 175940000,
      "state": "COMPLETE"
    },
    {
      "ack_us": 193000000,
      "action_id": "a.exec",
      "action_kind": "EXEC",
      "end_us": 193000000,
      "enqueue_us": 175900000,
      "lease_id": null,
      "parent_action_id": null,
      "request_ids": [
        "req.0",
        "req.1",
        "req.2"
      ],
      "start_us": 176000000,
      "state": "COMPLETE"
    },
    {
      "ack_us": 193500000,
      "action_id": "a.d2h",
      "action_kind": "D2H",
      "end_us": 193500000,
      "enqueue_us": 193000000,
      "lease_id": null,
      "parent_action_id": null,
      "request_ids": [],
      "start_us": 193000000,
      "state": "COMPLETE"
    },
    {
      "ack_us": 193700000,
      "action_id": "a.result",
      "action_kind": "RESULT_EMIT",
      "end_us": 193700000,
      "enqueue_us": 193500000,
      "lease_id": null,
      "parent_action_id": "a.exec",
      "request_ids": [
        "req.0",
        "req.1",
        "req.2"
      ],
      "start_us": 193600000,
      "state": "COMPLETE"
    },
    {
      "ack_us": 194100000,
      "action_id": "a.cleanup",
      "action_kind": "CLEANUP",
      "end_us": 194100000,
      "enqueue_us": 193700000,
      "lease_id": null,
      "parent_action_id": null,
      "request_ids": [],
      "start_us": 193800000,
      "state": "COMPLETE"
    },
    {
      "ack_us": 194200000,
      "action_id": "a.release",
      "action_kind": "LEASE_RELEASE",
      "end_us": 194200000,
      "enqueue_us": 194100000,
      "lease_id": "lease.0",
      "parent_action_id": null,
      "request_ids": [],
      "start_us": 194100000,
      "state": "COMPLETE"
    },
    {
      "ack_us": 194400000,
      "action_id": "a.drain",
      "action_kind": "QUEUE_DRAIN",
      "end_us": 194400000,
      "enqueue_us": 194200000,
      "lease_id": null,
      "parent_action_id": null,
      "request_ids": [],
      "start_us": 194300000,
      "state": "COMPLETE"
    }
  ],
  "clock_epoch_id": "boot-synthetic-e2a-0000",
  "drain_acknowledged_us": 194400000,
  "entry_state_digest": "19d5be7967e39c79d7e3a117176cc2b51c1b1871499aa11e4eacb0678c744973",
  "exit_state_digest": "19d5be7967e39c79d7e3a117176cc2b51c1b1871499aa11e4eacb0678c744973",
  "kind": "LifecycleRecord",
  "lifecycle_id": "lc.slot06",
  "record_sha256": "5620b6b10dd41b5fea6bd1878f73cb47e9c8286ea087a1b8a4e07db6347282a2",
  "run_nonce": "run.tl.slot06",
  "schema_version": 2,
  "set_id": "set.s10.e2a.synthetic",
  "timeline_id": "tl.slot06",
  "window_end_us": 195000000,
  "window_start_us": 175000000
}
